{
  "schema_version": "s2_13_s3_7_transition_readiness@3.0.0",
  "report_id": "s2_13_s3_7_transition_readiness_v3",
  "build_note": "Every state judgment in this report is re-derived from current on-disk assets, manifests, hashes, or executed independent verifiers; no hardcoded existence conclusions and no wall-clock timestamps. v2 adds the three-state Gold-Rule-Record probe, exact in-memory reconstruction of the manifest and the export index (no entry-level iteration that could miss missing or extra entries), and the strict non-JSON verifier verdict. Rebuilding on identical inputs produces byte-identical outputs; existing outputs with different bytes are refused.",
  "supersedes": [
    {
      "path": "outputs/reports/s2_13_stage2_freeze_gap_capsule.json",
      "sha256": "eb934910c2e046c43cfae063ff8eac69e124fda65830f5c50cb2e1fd50abc311",
      "reason": "2026-08-11 current-state judgment predates the S1.7 freeze (2026-08-13) and still lists S1.7 as blocked ('true Gold Process Records'); the remaining-items list is superseded by this v2 ledger while the historical file stays unmodified."
    },
    {
      "path": "outputs/reports/s2_13_stage2_freeze_gap_capsule.md",
      "sha256": "ca369600d594359bbbe1977c16ee4443d9ee16c0a5e7accf0e4b5081bf3a18ac",
      "reason": "2026-08-11 Markdown rendering of the same superseded gap capsule; preserved unmodified as historical provenance."
    },
    {
      "path": "outputs/reports/s3_7_oracle_readiness_v2.json",
      "sha256": "0e79232bb17b172ea6f5f105e6a3e75a9aa2d67a42614c66a1e65a566da9827b",
      "reason": "2026-08-11 current-state judgment is stale: it hardcodes gold_process_records.exist=false with 'S1.5 human Process Gold not started', which the 2026-08-13 Stage 1 Process Gold publication and S1.7 freeze invalidated; superseded by this v2 ledger, historical content preserved."
    },
    {
      "path": "outputs/reports/s37_oracle_readiness_v1.json",
      "sha256": "7bd3e8dec72be75a4b3414c889839b5891e59e47707b3845a59e510328dd5a7b",
      "reason": "2026-08-09 current-state judgment is stale: 'true Gold Process Records not present' and the S1.7 gap no longer hold after 2026-08-13; its Gold-Rule-Records absence finding remains true and is carried forward; superseded by this v2 ledger, historical content preserved."
    },
    {
      "path": "outputs/reports/formal_benchmark_release_v2.manifest.json",
      "sha256": "8b3cbd2e6081a31bb3d2fec018f11ed9c5bf45d0ec51507050bb9472c3ed4447",
      "reason": "Its publication-time exclusions block ('gold_process_records DO NOT EXIST', 'gold_rule_records DO NOT EXIST') is a historical snapshot: the gold_process_records exclusion is now stale (Stage 1 Process Gold published 2026-08-13) while the gold_rule_records exclusion remains true; the release manifest file itself stays unmodified."
    },
    {
      "path": "scripts/build_s1_5_s3_7_readiness_v1.py",
      "sha256": "dc474b80485dd1d355f8a677be0988834a78f4fd56601de8ecf1b8e1fd1ee68b",
      "reason": "Historical builder that hardcodes the pre-freeze conclusion 'true Gold Process Records DO NOT EXIST (S1.5 human Process Gold not started)'; preserved unmodified as provenance; its current-state output logic is superseded by this deterministic v2 builder."
    },
    {
      "path": "scripts/build_s3_7_oracle_readiness.py",
      "sha256": "71881cb446e1aa492e69ec07f1f1fdcd6331568ac36b70d0f0d99c2b849b9b09",
      "reason": "Historical builder for s37_oracle_readiness_v1.json that hardcodes 'true Gold Process Records ... NOT present'; preserved unmodified as provenance; its current-state output logic is superseded by this deterministic v2 builder."
    },
    {
      "path": "configs/schemas/s2_13_s3_7_transition_readiness.schema.json",
      "sha256": "df270ee8ee27bd2c59686d396df7c37ecf6cafb1dd35ceb0aba48a63464f6786",
      "reason": "v1 schema; kept byte-exact. v2 supersedes v1's verifier-completeness guarantees (v1 schema cannot express the three-state Gold-Rule-Record probe, the exact manifest/export reconstruction checks, or the strict verifier verdict)."
    },
    {
      "path": "scripts/build_s2_13_s3_7_transition_readiness_v1.py",
      "sha256": "38b9d2f9c2e9f5215b28040f710857913f9c432d54c21cadb16255e210fff269",
      "reason": "v1 builder; kept byte-exact. Its Gold-Rule-Record probe computed candidates but unconditionally returned exist=false, its manifest and export checks only iterated existing entries, and its non-JSON verifier verdict accepted the bare 'VERIFIED' substring (which 'NOT VERIFIED' also contains); these v1 fail-closed gaps are superseded by the v2 builder."
    },
    {
      "path": "scripts/verify_s2_13_s3_7_transition_readiness_v1.py",
      "sha256": "5ee35fa837c05dc2e6c15168dcee0a4704486212c81c2710d16435e3e668ad1a",
      "reason": "v1 verifier; kept byte-exact. Its manifest/export checks only re-verified entries already present in the files (missing or empty maps escaped), so v2 supersedes that completeness guarantee."
    },
    {
      "path": "tests/test_s2_13_s3_7_transition_readiness_v1.py",
      "sha256": "f85c0bcf0e0075a64604898d0c6720384375e76effef82ec0d97ba5315d3fc4f",
      "reason": "v1 focused tests; kept byte-exact. v2 adds the three-state Gold-Rule-Record candidate, exact manifest/export reconstruction and strict verdict negative cases."
    },
    {
      "path": "outputs/reports/s2_13_s3_7_transition_readiness_v1.json",
      "sha256": "10913862225ba4b8b5ffcf02b5ba553ab6110ec6a59bc2b01913b3a60aa79524",
      "reason": "v1 transition ledger report; its current-state conclusions remain basically correct and are carried forward by v2, while its verifier-completeness / fail-closed guarantees are superseded by v2; the file stays byte-exact."
    },
    {
      "path": "outputs/reports/s2_13_s3_7_transition_readiness_v1.md",
      "sha256": "589fc8cee52ce443d503afad1e7fe6dbb05010cfba167b9449de3bcda5e0fa27",
      "reason": "v1 Markdown rendering; preserved byte-exact as historical provenance; the current-state report is superseded by the v2 report."
    },
    {
      "path": "outputs/reports/s2_13_s3_7_transition_readiness_v1.manifest.json",
      "sha256": "d399e2c9f98d24b4f66fae1ba76723c1547d18d9070fea8b86eb8d1b63620a87",
      "reason": "v1 manifest; preserved byte-exact; v2's manifest is independently re-constructed and compared exactly (v1 manifest structure is not modified)."
    },
    {
      "path": "outputs/reports/s2_13_s3_7_transition_readiness_v1_export_index.json",
      "sha256": "37289ac54f6f3994ce385c5bd335cd6f145823da29cc2bb8bd9f4b18600c312a",
      "reason": "v1 export index; preserved byte-exact; v2's export index is exactly re-constructed from disk bytes and compared (no entry-level iteration that could miss missing or extra entries)."
    },
    {
      "path": "configs/schemas/s2_13_s3_7_transition_readiness_v2.schema.json",
      "sha256": "2b0d9418e748eb49753dea75ca46db072dc60226b7dc08ea1eafc6ecfd8bbaaf",
      "reason": "v2 schema; kept byte-exact (historical lifecycle semantics)."
    },
    {
      "path": "scripts/build_s2_13_s3_7_transition_readiness_v2.py",
      "sha256": "c20c8a1f198ab357cd567a3746758b6668e4ca0f50262ee97c789829388f21d1",
      "reason": "v2 builder; kept byte-exact; its S2.11 current-state judgment (blocked on authorization) is superseded by v3."
    },
    {
      "path": "scripts/verify_s2_13_s3_7_transition_readiness_v2.py",
      "sha256": "b9639016634af014e9e779ff127de49da2f26b277eef3360a202260aab7996ab",
      "reason": "v2 verifier; kept byte-exact; its active-verification role is superseded by v3."
    },
    {
      "path": "tests/test_s2_13_s3_7_transition_readiness_v2.py",
      "sha256": "b39b8fe3b2daf5fa7a4902142edc9f514964fce8189def3f71b8b932dfb149c2",
      "reason": "v2 pytest file: CORRECTED lifecycle test semantics only (v3); the v2 core assets are untouched."
    },
    {
      "path": "outputs/reports/s2_13_s3_7_transition_readiness_v2.json",
      "sha256": "6fca5c03349dd66a34b68e9e3eba2f99c724377ed88d38a2827a860c875a1995",
      "reason": "v2 transition ledger report; byte-exact historical provenance; its S2.11=blocked judgment is superseded by v3."
    },
    {
      "path": "outputs/reports/s2_13_s3_7_transition_readiness_v2.md",
      "sha256": "7f598664d73219e3d43f62137d31ecce669ba5d642bbf4faa5f9e6def652d916",
      "reason": "v2 Markdown rendering; byte-exact historical provenance."
    },
    {
      "path": "outputs/reports/s2_13_s3_7_transition_readiness_v2.manifest.json",
      "sha256": "d86494ffd03a4e78a9d2aa93a1b21dfde060ed68c3214c42bfb3134dd32825a1",
      "reason": "v2 manifest; byte-exact historical provenance."
    },
    {
      "path": "outputs/reports/s2_13_s3_7_transition_readiness_v2_export_index.json",
      "sha256": "71b418a958e6bc9b2505c5c71cb6b66766feaa7c6f3483fba3a2736ae3ca881a",
      "reason": "v2 export index; byte-exact historical provenance."
    }
  ],
  "dependency_matrix": {
    "stage1": [
      {
        "task_id": "S1.5",
        "status": "verified",
        "note": "Stage 1 Process Gold frozen and published (user-authorized 2026-08-13; 7/7 records, 135/135 label fields, 7/7 structure decisions); independent verifier scripts/verify_stage1_process_gold.py VERIFIED.",
        "evidence": [
          {
            "path": "data/gold/stage1/process_records/stage1_process_gold_v1.json",
            "kind": "disk_asset",
            "sha256": "f33aa857a0796d0517a9d04cc96b0a4f316202603fe0adf66693aeb5cb444bca"
          },
          {
            "path": "data/gold/stage1/manifest.json",
            "kind": "manifest",
            "sha256": "1885dad26f43b19324f2e779a7bbed0db5b19699145d8607a59439423b23e587"
          },
          {
            "path": "outputs/reports/s1_5_process_gold_freeze_authorization_v1.manifest.json",
            "kind": "manifest",
            "sha256": "4b97762cfe3cb336a2a163bd85cbc850f9963a513af8a33185efae7d0486e25c"
          },
          {
            "path": "scripts/verify_stage1_process_gold.py",